created_utc,id,num_comments,score,selftext,subreddit,title,url,created,d_
1558914384,bteyp6,945,16798,,technology,"Qualcomm Ruled a Monopoly, Found in Violation of US Antitrust Law",https://www.extremetech.com/computing/291851-qualcomm-ruled-a-monopoly-found-in-violation-of-us-antitrust-law,1558943184.0,"{'created_utc': 1558914384, 'id': 'bteyp6', 'num_comments': 945, 'score': 16798, 'selftext': '', 'subreddit': 'technology', 'title': 'Qualcomm Ruled a Monopoly, Found in Violation of US Antitrust Law', 'url': 'https://www.extremetech.com/computing/291851-qualcomm-ruled-a-monopoly-found-in-violation-of-us-antitrust-law', 'created': 1558943184.0}"
1568284462,d35yij,2375,7504,,Android,Apple A13 77% faster single-core compared to Qualcomm Snapdragon 855 in Geekbench 5,https://browser.geekbench.com/v5/cpu/124312,1568313262.0,"{'created_utc': 1568284462, 'id': 'd35yij', 'num_comments': 2375, 'score': 7504, 'selftext': '', 'subreddit': 'Android', 'title': 'Apple A13 77% faster single-core compared to Qualcomm Snapdragon 855 in Geekbench 5', 'url': 'https://browser.geekbench.com/v5/cpu/124312', 'created': 1568313262.0}"
1550525367,as2brw,471,5572,,nfl,"The city of San Diego paid the Chargers over a million dollars a year to play at SDCCU/Qualcomm. With the Fleet of the AAF, the city is breaking even, if not making money from holding games there.",https://www.usatoday.com/story/sports/2019/02/18/aaf-football-san-diego-fleet/2903068002/,1550554167.0,"{'created_utc': 1550525367, 'id': 'as2brw', 'num_comments': 471, 'score': 5572, 'selftext': '', 'subreddit': 'nfl', 'title': 'The city of San Diego paid the Chargers over a million dollars a year to play at SDCCU/Qualcomm. With the Fleet of the AAF, the city is breaking even, if not making money from holding games there.', 'url': 'https://www.usatoday.com/story/sports/2019/02/18/aaf-football-san-diego-fleet/2903068002/', 'created': 1550554167.0}"
1568263082,d32svb,539,4135,,explainlikeimfive,ELI5: How do companies like Apple and Qualcomm continue to produce faster and more powerful chips year after year? Are engineers still making new discoveries in the industry or have we had this technology all along and are controlling the rate at which our technology improves?,https://www.reddit.com/r/explainlikeimfive/comments/d32svb/eli5_how_do_companies_like_apple_and_qualcomm/,1568291882.0,"{'created_utc': 1568263082, 'id': 'd32svb', 'num_comments': 539, 'score': 4135, 'selftext': '', 'subreddit': 'explainlikeimfive', 'title': 'ELI5: How do companies like Apple and Qualcomm continue to produce faster and more powerful chips year after year? Are engineers still making new discoveries in the industry or have we had this technology all along and are controlling the rate at which our technology improves?', 'url': 'https://www.reddit.com/r/explainlikeimfive/comments/d32svb/eli5_how_do_companies_like_apple_and_qualcomm/', 'created': 1568291882.0}"
1555615297,bepkto,567,3640,,apple,"Apple Paid an Estimated $5-$6 Billion to Settle Qualcomm Dispute, Plus $8-$9 Per iPhone in Royalty Fees",https://www.macrumors.com/2019/04/18/apple-qualcomm-estimated-settlement-terms/,1555644097.0,"{'created_utc': 1555615297, 'id': 'bepkto', 'num_comments': 567, 'score': 3640, 'selftext': '', 'subreddit': 'apple', 'title': 'Apple Paid an Estimated $5-$6 Billion to Settle Qualcomm Dispute, Plus $8-$9 Per iPhone in Royalty Fees', 'url': 'https://www.macrumors.com/2019/04/18/apple-qualcomm-estimated-settlement-terms/', 'created': 1555644097.0}"
1558942941,btj6zn,372,3153,,news,"Qualcomm Ruled a Monopoly, Found in Violation of US Antitrust Law",https://www.extremetech.com/computing/291851-qualcomm-ruled-a-monopoly-found-in-violation-of-us-antitrust-law,1558971741.0,"{'created_utc': 1558942941, 'id': 'btj6zn', 'num_comments': 372, 'score': 3153, 'selftext': '', 'subreddit': 'news', 'title': 'Qualcomm Ruled a Monopoly, Found in Violation of US Antitrust Law', 'url': 'https://www.extremetech.com/computing/291851-qualcomm-ruled-a-monopoly-found-in-violation-of-us-antitrust-law', 'created': 1558971741.0}"
1558334655,bqs29k,1099,3138,,Android,"Bloomberg: Intel, Broadcom and Qualcomm follows in Googles footstep against Huawei",https://www.bloomberg.com/news/articles/2019-05-19/google-to-end-some-huawei-business-ties-after-trump-crackdown,1558363455.0,"{'created_utc': 1558334655, 'id': 'bqs29k', 'num_comments': 1099, 'score': 3138, 'selftext': '', 'subreddit': 'Android', 'title': 'Bloomberg: Intel, Broadcom and Qualcomm follows in Googles footstep against Huawei', 'url': 'https://www.bloomberg.com/news/articles/2019-05-19/google-to-end-some-huawei-business-ties-after-trump-crackdown', 'created': 1558363455.0}"
1557033791,bku83z,140,2561,,The_Donald,GEOTUS RETWEETS: DOJ ASKS COURTS TO LIGHTEN UP ON QUALCOMM AS IT BATTLES CHINA FOR 5G SUPREMACY,https://dailycaller.com/2019/05/03/doj-qualcomm-technology/?utm_medium=Social&amp;utm_campaign=atdailycaller&amp;utm_source=Twitter,1557062591.0,"{'created_utc': 1557033791, 'id': 'bku83z', 'num_comments': 140, 'score': 2561, 'selftext': '', 'subreddit': 'The_Donald', 'title': 'GEOTUS RETWEETS: DOJ ASKS COURTS TO LIGHTEN UP ON QUALCOMM AS IT BATTLES CHINA FOR 5G SUPREMACY', 'url': 'https://dailycaller.com/2019/05/03/doj-qualcomm-technology/?utm_medium=Social&amp;utm_campaign=atdailycaller&amp;utm_source=Twitter', 'created': 1557062591.0}"
1555441679,bdxu73,552,2381,,apple,Qualcomm and Apple agree to drop all litigation,https://www.apple.com/newsroom/2019/04/qualcomm-and-apple-agree-to-drop-all-litigation/,1555470479.0,"{'created_utc': 1555441679, 'id': 'bdxu73', 'num_comments': 552, 'score': 2381, 'selftext': '', 'subreddit': 'apple', 'title': 'Qualcomm and Apple agree to drop all litigation', 'url': 'https://www.apple.com/newsroom/2019/04/qualcomm-and-apple-agree-to-drop-all-litigation/', 'created': 1555470479.0}"
1552609044,b180ib,248,1881,,apple,US judge rules Qualcomm owes Apple nearly $1 billion rebate payment,https://www.cnbc.com/2019/03/15/us-judge-rules-qualcomm-owes-apple-nearly-1-billion-rebate-payment.html,1552637844.0,"{'created_utc': 1552609044, 'id': 'b180ib', 'num_comments': 248, 'score': 1881, 'selftext': '', 'subreddit': 'apple', 'title': 'US judge rules Qualcomm owes Apple nearly $1 billion rebate payment', 'url': 'https://www.cnbc.com/2019/03/15/us-judge-rules-qualcomm-owes-apple-nearly-1-billion-rebate-payment.html', 'created': 1552637844.0}"
